{
  "acl_policy_digest": "sha-256:1111111111111111111111111111111111111111111111111111111111111111",
  "acl_policy_version": "acl-v1",
  "channel_id": "channel:release",
  "channel_uri": "https://coord.example/channels/project-release",
  "created_at": "2026-08-02T16:00:00.000Z",
  "retention_epoch": 0,
  "retention_policy_digest": "sha-256:1111111111111111111111111111111111111111111111111111111111111111",
  "specversion": "0.1",
  "tenant_id": "tenant:example"
}
